{
  "schemaVersion": 1,
  "id": "golden-v1",
  "createdAt": "2026-09-28T00:00:00.000Z",
  "updatedAt": "2026-09-28T00:00:00.000Z",
  "revision": 3,
  "canvas": {
    "width": 800,
    "height": 500
  },
  "objects": [
    {
      "rx": 0,
      "ry": 0,
      "id": "a2036d7d-837c-4fd9-8d0b-417e89165a8a",
      "type": "Rect",
      "version": "7.4.0",
      "originX": "center",
      "originY": "center",
      "left": 20,
      "top": 20,
      "width": 60,
      "height": 40,
      "fill": "#264653",
      "stroke": null,
      "strokeWidth": 1,
      "strokeDashArray": null,
      "strokeLineCap": "butt",
      "strokeDashOffset": 0,
      "strokeLineJoin": "miter",
      "strokeUniform": false,
      "strokeMiterLimit": 4,
      "scaleX": 1,
      "scaleY": 1,
      "angle": 12,
      "flipX": false,
      "flipY": false,
      "opacity": 1,
      "shadow": null,
      "visible": true,
      "backgroundColor": "",
      "fillRule": "nonzero",
      "paintFirst": "fill",
      "globalCompositeOperation": "source-over",
      "skewX": 0,
      "skewY": 0
    },
    {
      "fontSize": 24,
      "fontWeight": "normal",
      "fontFamily": "sans-serif",
      "fontStyle": "normal",
      "lineHeight": 1.16,
      "text": "Golden title",
      "charSpacing": 0,
      "textAlign": "left",
      "styles": [],
      "pathStartOffset": 0,
      "pathSide": "left",
      "pathAlign": "baseline",
      "underline": false,
      "overline": false,
      "linethrough": false,
      "textBackgroundColor": "",
      "direction": "ltr",
      "textDecorationThickness": 66.667,
      "id": "0165659b-3c80-4392-bb46-4ded4376f85e",
      "type": "IText",
      "version": "7.4.0",
      "originX": "center",
      "originY": "center",
      "left": 120,
      "top": 30,
      "width": 121.4063,
      "height": 27.12,
      "fill": "rgb(0,0,0)",
      "stroke": null,
      "strokeWidth": 1,
      "strokeDashArray": null,
      "strokeLineCap": "butt",
      "strokeDashOffset": 0,
      "strokeLineJoin": "miter",
      "strokeUniform": false,
      "strokeMiterLimit": 4,
      "scaleX": 1,
      "scaleY": 1,
      "angle": 0,
      "flipX": false,
      "flipY": false,
      "opacity": 1,
      "shadow": null,
      "visible": true,
      "backgroundColor": "",
      "fillRule": "nonzero",
      "paintFirst": "fill",
      "globalCompositeOperation": "source-over",
      "skewX": 0,
      "skewY": 0
    },
    {
      "cropX": 0,
      "cropY": 0,
      "id": "3a8dfd77-8203-4808-a76a-343efa3dc30c",
      "type": "Image",
      "version": "7.4.0",
      "originX": "center",
      "originY": "center",
      "left": 300,
      "top": 40,
      "width": 2,
      "height": 2,
      "fill": "rgb(0,0,0)",
      "stroke": null,
      "strokeWidth": 0,
      "strokeDashArray": null,
      "strokeLineCap": "butt",
      "strokeDashOffset": 0,
      "strokeLineJoin": "miter",
      "strokeUniform": false,
      "strokeMiterLimit": 4,
      "scaleX": 20,
      "scaleY": 20,
      "angle": 0,
      "flipX": false,
      "flipY": false,
      "opacity": 1,
      "shadow": null,
      "visible": true,
      "backgroundColor": "",
      "fillRule": "nonzero",
      "paintFirst": "fill",
      "globalCompositeOperation": "source-over",
      "skewX": 0,
      "skewY": 0,
      "src": "data:image/png;base64,iVBORw0KGgoAAAANSUhEUgAAAAIAAAACCAYAAABytg0kAAAAFElEQVR4AWJiYGD4D8IgBpBmYAAAAAD//7vS9wEAAAAGSURBVAMAGDACA6ybwrYAAAAASUVORK5CYII=",
      "crossOrigin": null,
      "filters": []
    },
    {
      "subTargetCheck": false,
      "interactive": false,
      "id": "b30b0b97-d04f-4042-b6fb-c83e51b560fb",
      "type": "Group",
      "version": "7.4.0",
      "originX": "center",
      "originY": "center",
      "left": 200,
      "top": 200,
      "width": 53,
      "height": 25,
      "fill": "rgb(0,0,0)",
      "stroke": null,
      "strokeWidth": 0,
      "strokeDashArray": null,
      "strokeLineCap": "butt",
      "strokeDashOffset": 0,
      "strokeLineJoin": "miter",
      "strokeUniform": false,
      "strokeMiterLimit": 4,
      "scaleX": 1,
      "scaleY": 1,
      "angle": 0,
      "flipX": false,
      "flipY": false,
      "opacity": 1,
      "shadow": null,
      "visible": true,
      "backgroundColor": "",
      "fillRule": "nonzero",
      "paintFirst": "fill",
      "globalCompositeOperation": "source-over",
      "skewX": 0,
      "skewY": 0,
      "layoutManager": {
        "type": "layoutManager",
        "strategy": "fit-content"
      },
      "objects": [
        {
          "radius": 12,
          "startAngle": 0,
          "endAngle": 360,
          "counterClockwise": false,
          "id": "63301e98-d06d-4ffa-a0aa-b290434d52b9",
          "type": "Circle",
          "version": "7.4.0",
          "originX": "center",
          "originY": "center",
          "left": -14,
          "top": 0,
          "width": 24,
          "height": 24,
          "fill": "#2a9d8f",
          "stroke": null,
          "strokeWidth": 1,
          "strokeDashArray": null,
          "strokeLineCap": "butt",
          "strokeDashOffset": 0,
          "strokeLineJoin": "miter",
          "strokeUniform": false,
          "strokeMiterLimit": 4,
          "scaleX": 1,
          "scaleY": 1,
          "angle": 0,
          "flipX": false,
          "flipY": false,
          "opacity": 1,
          "shadow": null,
          "visible": true,
          "backgroundColor": "",
          "fillRule": "nonzero",
          "paintFirst": "fill",
          "globalCompositeOperation": "source-over",
          "skewX": 0,
          "skewY": 0
        },
        {
          "rx": 0,
          "ry": 0,
          "id": "e0f89f29-8191-4554-834a-d26c13e9d70b",
          "type": "Rect",
          "version": "7.4.0",
          "originX": "center",
          "originY": "center",
          "left": 16,
          "top": 0,
          "width": 20,
          "height": 20,
          "fill": "#e9c46a",
          "stroke": null,
          "strokeWidth": 1,
          "strokeDashArray": null,
          "strokeLineCap": "butt",
          "strokeDashOffset": 0,
          "strokeLineJoin": "miter",
          "strokeUniform": false,
          "strokeMiterLimit": 4,
          "scaleX": 1,
          "scaleY": 1,
          "angle": 0,
          "flipX": false,
          "flipY": false,
          "opacity": 1,
          "shadow": null,
          "visible": true,
          "backgroundColor": "",
          "fillRule": "nonzero",
          "paintFirst": "fill",
          "globalCompositeOperation": "source-over",
          "skewX": 0,
          "skewY": 0
        }
      ]
    },
    {
      "rx": 0,
      "ry": 0,
      "id": "4c01f812-bcf4-4eb1-9e01-8d5a2d558435",
      "type": "Rect",
      "version": "7.4.0",
      "originX": "center",
      "originY": "center",
      "left": 40,
      "top": 300,
      "width": 80,
      "height": 60,
      "fill": "#e76f51",
      "stroke": null,
      "strokeWidth": 1,
      "strokeDashArray": null,
      "strokeLineCap": "butt",
      "strokeDashOffset": 0,
      "strokeLineJoin": "miter",
      "strokeUniform": false,
      "strokeMiterLimit": 4,
      "scaleX": 1,
      "scaleY": 1,
      "angle": 0,
      "flipX": false,
      "flipY": false,
      "opacity": 1,
      "shadow": null,
      "visible": true,
      "backgroundColor": "",
      "fillRule": "nonzero",
      "paintFirst": "fill",
      "globalCompositeOperation": "source-over",
      "skewX": 0,
      "skewY": 0,
      "clipPath": {
        "radius": 25,
        "startAngle": 0,
        "endAngle": 360,
        "counterClockwise": false,
        "inverted": false,
        "absolutePositioned": false,
        "type": "Circle",
        "version": "7.4.0",
        "originX": "center",
        "originY": "center",
        "left": 0,
        "top": 0,
        "width": 50,
        "height": 50,
        "fill": "rgb(0,0,0)",
        "stroke": null,
        "strokeWidth": 1,
        "strokeDashArray": null,
        "strokeLineCap": "butt",
        "strokeDashOffset": 0,
        "strokeLineJoin": "miter",
        "strokeUniform": false,
        "strokeMiterLimit": 4,
        "scaleX": 1,
        "scaleY": 1,
        "angle": 0,
        "flipX": false,
        "flipY": false,
        "opacity": 1,
        "shadow": null,
        "visible": true,
        "backgroundColor": "",
        "fillRule": "nonzero",
        "paintFirst": "fill",
        "globalCompositeOperation": "source-over",
        "skewX": 0,
        "skewY": 0
      }
    },
    {
      "rx": 0,
      "ry": 0,
      "id": "7227d959-11dc-43bd-8dec-3b2b9eb5faa4",
      "label": "Chair",
      "type": "Sticker",
      "version": "7.4.0",
      "originX": "center",
      "originY": "center",
      "left": 400,
      "top": 300,
      "width": 40,
      "height": 40,
      "fill": "#8338ec",
      "stroke": null,
      "strokeWidth": 1,
      "strokeDashArray": null,
      "strokeLineCap": "butt",
      "strokeDashOffset": 0,
      "strokeLineJoin": "miter",
      "strokeUniform": false,
      "strokeMiterLimit": 4,
      "scaleX": 1,
      "scaleY": 1,
      "angle": 0,
      "flipX": false,
      "flipY": false,
      "opacity": 1,
      "shadow": null,
      "visible": true,
      "backgroundColor": "",
      "fillRule": "nonzero",
      "paintFirst": "fill",
      "globalCompositeOperation": "source-over",
      "skewX": 0,
      "skewY": 0
    }
  ],
  "assets": {
    "images": [],
    "fonts": [
      {
        "family": "sans-serif",
        "weight": "normal",
        "style": "normal",
        "objectIds": [
          "0165659b-3c80-4392-bb46-4ded4376f85e"
        ]
      }
    ]
  },
  "metadata": {
    "title": "Golden document",
    "owner": "contract-tests"
  },
  "fabricVersion": "7.4.0"
}
